{
  "schema": "sycl-agent/run-record",
  "run_id": "build-dequantize-quantize-lib-20260906T183816Z-131b48",
  "class": "build",
  "subject": "dequantize-quantize-lib",
  "label": "migrate",
  "phase": "migrate",
  "ts": "2026-09-06T18:38:34Z",
  "duration_s": 18.108,
  "command": "bash -lc ssh\\ -p\\ 2332\\ -o\\ BatchMode=yes\\ -o\\ StrictHostKeyChecking=accept-new\\ root@10.239.98.41\\ \\'cd\\ /workspace/sycl-agent-runs/llama.cpp\\ \\&\\&\\ source\\ /opt/intel/oneapi/setvars.sh\\ \\>/dev/null\\ 2\\>\\&1\\ \\&\\&\\ icx\\ -std=c11\\ -Iggml/include\\ -Iggml/src\\ -c\\ ggml/src/ggml-quants.c\\ -o\\ .sycl/scratch/ggml-quants.o\\ \\&\\&\\ icpx\\ -fsycl\\ -std=c++17\\ -I.\\ -Iggml/include\\ -Iggml/src\\ -Iggml/src/ggml-sycl\\ .sycl/scratch/quant_sycl_validation.cpp\\ .sycl/scratch/ggml_stubs.cpp\\ ggml/src/ggml-sycl/dequantize.cpp\\ ggml/src/ggml-sycl/quantize.cpp\\ .sycl/scratch/ggml-quants.o\\ -o\\ .sycl/scratch/quant_sycl_validation\\'",
  "via": "local",
  "runner": {
    "mode": "local"
  },
  "env_fingerprint": "env-68d8b007",
  "commit": "cd70e6a76",
  "dirty": true,
  "exit_code": 0,
  "verdict": "pass",
  "log": "evidence/build/dequantize-quantize-lib/build-dequantize-quantize-lib-20260906T183816Z-131b48.log",
  "log_sha256": "e3b0c44298fc1c149afbf4c8996fb92427ae41e4649b934ca495991b7852b855",
  "log_bytes": 0,
  "log_truncated": false,
  "artifacts": [
    {
      "path": "../scratch/quant_sycl_validation.cpp",
      "kind": "cpp",
      "sha256": "3537062a05f4b197db4c40f26f4c703bde114c340db7d5341a01fc1cb983e929",
      "bytes": 12437
    },
    {
      "path": "../scratch/ggml_stubs.cpp",
      "kind": "cpp",
      "sha256": "0ea7c3e3cc21c749c17e5e88eb36a6d3676dfe8b4c7c45fb96bc39364d93f6e8",
      "bytes": 3288
    }
  ],
  "measurements": {},
  "extracted": {},
  "notes": "remote selftest rebuild via SSH fallback after adding F32/F16 direct-convert coverage; run.sh GPU lock was saturated by other agents"
}
