{
  "schema": "sycl-agent/run-record",
  "run_id": "test-norm-family-20260906T173938Z-737da8",
  "class": "test",
  "subject": "norm-family",
  "phase": "migrate",
  "ts": "2026-09-06T17:39:42Z",
  "duration_s": 4.063,
  "command": "./build/bin/test-backend-ops -o NORM,RMS_NORM,GROUP_NORM,L2_NORM",
  "via": "run.sh test",
  "runner": {
    "mode": "remote",
    "host": "10.239.98.41",
    "workdir": "/workspace/sycl-agent-runs/llama.cpp"
  },
  "env_fingerprint": "env-68d8b007",
  "commit": "dd4cfda03",
  "dirty": true,
  "exit_code": 0,
  "verdict": "pass",
  "log": "evidence/test/norm-family/test-norm-family-20260906T173938Z-737da8.log",
  "log_sha256": "88fed6c9421db13f354aff12aac4c516b392aa7127e656c12ea1bb9d3595e46e",
  "log_bytes": 12742,
  "log_truncated": false,
  "artifacts": [],
  "measurements": {
    "reference": "cpu",
    "tolerance": {
      "source": "cuda-parity"
    }
  },
  "extracted": {}
}
