{
  "schema": "sycl-agent/run-record",
  "run_id": "test-fill-20260906T193053Z-d567d4",
  "class": "test",
  "subject": "fill",
  "phase": "migrate",
  "ts": "2026-09-06T19:30:56Z",
  "duration_s": 3.124,
  "command": "./build/bin/test-backend-ops -o FILL",
  "via": "run.sh test",
  "runner": {
    "mode": "remote",
    "host": "10.239.98.41",
    "workdir": "/workspace/sycl-agent-runs/llama.cpp"
  },
  "env_fingerprint": "env-68d8b007",
  "commit": "6f0f87888",
  "dirty": true,
  "exit_code": 0,
  "verdict": "pass",
  "log": "evidence/test/fill/test-fill-20260906T193053Z-d567d4.log",
  "log_sha256": "face219298cbaa207ec63953577118179d3843768196c33648bc6878ce11b0ef",
  "log_bytes": 1245,
  "log_truncated": false,
  "artifacts": [],
  "measurements": {
    "reference": "cpu",
    "tolerance": {
      "source": "cuda-parity"
    }
  },
  "extracted": {}
}
