{
  "schema": "sycl-agent/run-record",
  "run_id": "test-getrows-20260906T190355Z-994aec",
  "class": "test",
  "subject": "getrows",
  "phase": "migrate",
  "ts": "2026-09-06T19:04:25Z",
  "duration_s": 30.213,
  "command": "./build/bin/test-backend-ops -o GET_ROWS",
  "via": "run.sh test",
  "runner": {
    "mode": "remote",
    "host": "10.239.98.41",
    "workdir": "/workspace/sycl-agent-runs/llama.cpp"
  },
  "env_fingerprint": "env-68d8b007",
  "commit": "8a0bcdb99",
  "dirty": true,
  "exit_code": 0,
  "verdict": "pass",
  "log": "evidence/test/getrows/test-getrows-20260906T190355Z-994aec.log",
  "log_sha256": "7b4fe692fbe6679c3416de75cd959589cf7cab829fac42a4c716642029ba94f4",
  "log_bytes": 10127,
  "log_truncated": false,
  "artifacts": [],
  "measurements": {
    "reference": "cpu",
    "tolerance": {
      "source": "cuda-parity"
    }
  },
  "extracted": {}
}
