{
  "schema": "sycl-agent/run-record",
  "run_id": "test-opt-step-sgd-20260906T193123Z-bead5d",
  "class": "test",
  "subject": "opt-step-sgd",
  "phase": "migrate",
  "ts": "2026-09-06T19:31:26Z",
  "duration_s": 2.666,
  "command": "./build/bin/test-backend-ops -o OPT_STEP_SGD",
  "via": "run.sh test",
  "runner": {
    "mode": "remote",
    "host": "10.239.98.41",
    "workdir": "/workspace/sycl-agent-runs/llama.cpp"
  },
  "env_fingerprint": "env-68d8b007",
  "commit": "6f0f87888",
  "dirty": true,
  "exit_code": 0,
  "verdict": "pass",
  "log": "evidence/test/opt-step-sgd/test-opt-step-sgd-20260906T193123Z-bead5d.log",
  "log_sha256": "2a4853302b479b707b0b0fcc1183873f37c45e276dbdfc28aa95a97db26b6a7b",
  "log_bytes": 1064,
  "log_truncated": false,
  "artifacts": [],
  "measurements": {
    "reference": "cpu",
    "tolerance": {
      "source": "cuda-parity"
    }
  },
  "extracted": {}
}
