{
  "schema": "sycl-agent/run-record",
  "run_id": "test-softmax-20260906T190214Z-e9e8d4",
  "class": "test",
  "subject": "softmax",
  "phase": "migrate",
  "ts": "2026-09-06T19:02:22Z",
  "duration_s": 7.947,
  "command": "./build/bin/test-backend-ops -o SOFT_MAX,SOFT_MAX_BACK",
  "via": "run.sh test",
  "runner": {
    "mode": "remote",
    "host": "10.239.98.41",
    "workdir": "/workspace/sycl-agent-runs/llama.cpp"
  },
  "env_fingerprint": "env-68d8b007",
  "commit": "8a0bcdb99",
  "dirty": true,
  "exit_code": 0,
  "verdict": "pass",
  "log": "evidence/test/softmax/test-softmax-20260906T190214Z-e9e8d4.log",
  "log_sha256": "207693878a18df67dc01643830e9b18fd2b4f34695df20155f9cc09d7e152d85",
  "log_bytes": 33835,
  "log_truncated": false,
  "artifacts": [],
  "measurements": {
    "reference": "cpu",
    "tolerance": {
      "source": "cuda-parity"
    }
  },
  "extracted": {}
}
