{
  "schema": "sycl-agent/run-record",
  "run_id": "test-ssm-conv-20260906T213036Z-fe6456",
  "class": "test",
  "subject": "ssm-conv",
  "phase": "migrate",
  "ts": "2026-09-06T21:30:41Z",
  "duration_s": 5.174,
  "command": "./build/bin/test-backend-ops test -b SYCL0 -o SSM_CONV,SSM_CONV_BIAS_SILU",
  "via": "run.sh test",
  "runner": {
    "mode": "remote",
    "host": "10.239.98.41",
    "workdir": "/workspace/sycl-agent-runs/llama.cpp"
  },
  "env_fingerprint": "env-68d8b007",
  "commit": "83d85d665",
  "dirty": true,
  "exit_code": 0,
  "verdict": "pass",
  "log": "evidence/test/ssm-conv/test-ssm-conv-20260906T213036Z-fe6456.log",
  "log_sha256": "83453d795289fca91fe9a7292f05713e33062aea20a3467ca72c9c06b0f81917",
  "log_bytes": 12794,
  "log_truncated": false,
  "artifacts": [],
  "measurements": {
    "reference": "cpu",
    "tolerance": {
      "source": "cuda-parity"
    }
  },
  "extracted": {}
}
