{
  "schema": "sycl-agent/run-record",
  "run_id": "test-conv2d-20260906T213710Z-54c2cc",
  "class": "test",
  "subject": "conv2d",
  "phase": "migrate",
  "ts": "2026-09-06T21:37:13Z",
  "duration_s": 3.284,
  "command": "./build/bin/test-backend-ops -o CONV_2D -p \\(ne_input=\\\\\\[1\\,1\\,1\\,2\\\\\\]\\,ne_kernel=\\\\\\[1\\,1\\,1\\,1\\\\\\]\\,type_kernel=f32\\,stride0=1\\,stride1=5\\,padding0=5\\,padding1=2\\,dilation0=2\\,dilation1=4\\,cwhn=0\\)\\|\\(ne_input=\\\\\\[1\\,1\\,1\\,2\\\\\\]\\,ne_kernel=\\\\\\[1\\,1\\,1\\,1\\\\\\]\\,type_kernel=f16\\,stride0=1\\,stride1=5\\,padding0=5\\,padding1=2\\,dilation0=2\\,dilation1=4\\,cwhn=0\\)\\|\\(ne_input=\\\\\\[256\\,256\\,192\\,1\\\\\\]\\,ne_kernel=\\\\\\[3\\,3\\,192\\,96\\\\\\]\\,type_kernel=f32\\,stride0=1\\,stride1=1\\,padding0=1\\,padding1=1\\,dilation0=1\\,dilation1=1\\,cwhn=0\\)",
  "via": "run.sh test",
  "runner": {
    "mode": "remote",
    "host": "10.239.98.41",
    "workdir": "/workspace/sycl-agent-runs/llama.cpp"
  },
  "env_fingerprint": "env-68d8b007",
  "commit": "28f681bf3",
  "dirty": true,
  "exit_code": 0,
  "verdict": "pass",
  "log": "evidence/test/conv2d/test-conv2d-20260906T213710Z-54c2cc.log",
  "log_sha256": "61700a82c3026708d6e3de0834f8c043976cbffd85c67ef4f509b9c56526574d",
  "log_bytes": 1967,
  "log_truncated": false,
  "artifacts": [],
  "measurements": {
    "reference": "cpu",
    "tolerance": {
      "source": "cuda-parity"
    }
  },
  "extracted": {}
}
