{
  "schema": "sycl-agent/run-record",
  "run_id": "build-dequantize-quantize-lib-20260906T190411Z-f8f858",
  "class": "build",
  "subject": "dequantize-quantize-lib",
  "label": "migrate",
  "phase": "migrate",
  "ts": "2026-09-06T19:04:45Z",
  "duration_s": 34.888,
  "command": "bash .sycl/scratch/build_quant_sycl_validation.sh",
  "via": "run.sh build",
  "runner": {
    "mode": "remote",
    "host": "10.239.98.41",
    "workdir": "/workspace/sycl-agent-runs/llama.cpp"
  },
  "env_fingerprint": "env-68d8b007",
  "commit": "8a0bcdb99",
  "dirty": true,
  "exit_code": 0,
  "verdict": "pass",
  "log": "evidence/build/dequantize-quantize-lib/build-dequantize-quantize-lib-20260906T190411Z-f8f858.log",
  "log_sha256": "8fb7dae23fcea3a5dbf286ae6508258a5e6cc05bd5fb0318b5e81a539563eb72",
  "log_bytes": 867,
  "log_truncated": false,
  "artifacts": [
    {
      "path": "../scratch/quant_sycl_validation.cpp",
      "kind": "cpp",
      "sha256": "b3b90c508faf895e74447d0a4b9a93899123fd78ec95e8c44bee44653b8737a8",
      "bytes": 12550
    },
    {
      "path": "../scratch/ggml_stubs.cpp",
      "kind": "cpp",
      "sha256": "0ea7c3e3cc21c749c17e5e88eb36a6d3676dfe8b4c7c45fb96bc39364d93f6e8",
      "bytes": 3288
    },
    {
      "path": "../scratch/build_quant_sycl_validation.sh",
      "kind": "sh",
      "sha256": "661c0001a25c31836ae5c226f4c028eaa5b6676a3169652e5675096e832cae88",
      "bytes": 446
    }
  ],
  "measurements": {},
  "extracted": {},
  "notes": "standalone selftest build for SYCL quantize/dequantize helpers on B70 via run.sh"
}
